Как назывался официальный мяч-матч чемпионата мира по футболу 2018 года?	Телстар
Каким был родной язык Клеопатры VII, иначе известной как Клеопатра, царица Египта?	Греческий
Каково было первоначальное предназначение Великой пирамиды в Гизе?	Гробница фараона Хуфу
Каково было царственное имя последнего императора китайской династии Цин?	Сюаньтун
Каковы были отношения между знаменитыми полководцами Толуем и Чингисханом?	Отец и сын
Где проходил финальный матч чемпионата мира по футболу 2018 года в России?	Стадион «Лужники», Москва
Каким оружием владеет полководец Ричард I?	Топор и щит
Каким оружием владеют Хранители города?	Топор и щит
Каким оружием владеет командир Хранитель города?	Топор и щит
Из чего были сделаны пирамиды майя?	Камень
От чего прятались мужчины и женщины на окраине Флоренции в сборнике новелл «Декамерон»?	Черная чума
Что делает навык альянса «Полная загрузка» при использовании?	Увеличивает скорость сбора ресурсов для членов альянса.
Что делает навык альянса «Дар природы» при использовании?	Призыв очков ресурсов в выбранной области
Что делает навык альянса «Искусный мастер» при использовании?	Значительно увеличивает скорость строительства флага альянса.
Какова основная причина образования Гималаев?	Столкновение между пластинами
Когда мэрия губернатора достигает 25-го уровня, сколько ферм он может построить?	4.0
Когда Ахилл отказывается сражаться, Патрокл надевает доспехи Ахиллеса, сражается с троянцами и умирает. Кем убит Патрокл?	Гектор
Когда члены альянса собирают ресурсы на территории альянса, насколько увеличивается их скорость сбора?	25%
Когда «крутой» или «нуарный» литературный жанр художественной литературы впервые появился на плаву?	1920-е годы
Когда началась война за австрийское наследство?	1740-1748
Когда влажный воздух сталкивается с препятствием, таким как горный хребет, и выталкивается вверх при понижении температуры воздуха, что приводит к дождю, это известно как:	Орографические осадки
Когда на него не действуют положительные эффекты, сколько ресурсов есть у Хранилища 25-го уровня для каждого типа ресурсов?	2500000.0
Во время плавания во время грозы иногда можно увидеть эффект «молнии» на кончике мачты. Как называется это явление?	Огонь Святого Эльма
Когда кто-то наступает на банановую кожуру в обуви, коэффициент трения между его ботинком и банановой кожурой составляет:	0.07
Когда была изобретена Coca-Cola?	19 век
Когда родился Наполеон Бонапарт?	1769.0
Когда была написана Декларация независимости?	1776.0
Когда состоялся первый Венецианский кинофестиваль?	1932.0
Когда был изобретен терменвокс, один из первых электронных музыкальных инструментов?	1919.0
Когда велосипеды появились в Европе?	19 век
Где находятся крупнейшие в мире доказанные запасы нефти?	Поле Гавар
Откуда взялся Гиппократ, «отец медицины»?	Древняя Греция
Куда король Франции Людовик XIV перенес королевский двор в 1682 году?	Версальский дворец
Где зародилась музыка регги?	Ямайка
Где произошла финальная битва между королем Артуром и Мордредом, согласно легенде о короле Артуре?	Камланн
С чего начался Ренессанс?	Италия
Откуда берутся адаптации?	И мутации, и генетическая рекомбинация
Где начинается большинство ураганов?	В открытом море
Где проживает большая часть айнов?	Хоккайдо
Где в Египте находится Сфинкс?	Плато Гизы
Где в Италии находится Ватикан?	Рим
Где находится столица Шотландии?	Эдинбург
Где находится столица Германии?	Берлин
Откуда полководец Гай Марий?	Древний Рим
Где находится самая большая пирамида в мире?	Великая пирамида Чолула
Где, как сообщается, находится родина танца живота?	Египет
Где покоится правая рука знаменитой скульптуры, известной как «Мыслитель»?	Под подбородком
Где родился коммандер Лохар?	В далеком варварском племени
Где родился знаменитый музыкант Бетховен?	Бонн
Куда был сослан Наполеон Бонапарт после поражения при Ватерлоо?	Остров Святой Елены
Где родился Пабло Пикассо?	Иберия
Где родился вождь Чероли Торгни?	Цитадель храбрецов
Где родился композитор Вольфганг Амадей Моцарт?	Зальцбург
Где был пункт сбора первого крестового похода?	Константинополь
Где была найдена Терракотовая армия, внесенная в список Всемирного наследия?	В королевском мавзолее
Какое достижение открывается при улучшении 2 больниц до 25 уровня?	Хейл и Харти
Какая древняя цивилизация построила «Затерянный город» Мачу-Пикчу?	Инки
Какое древнеегипетское божество изображается с головой льва?	Тефнут
Какую гробницу древнеегипетского фараона обнаружил британский археолог Говард Картер в 1922 году?	Тутанхамона
Какой древнегреческий драматург написал знаменитую трагедию «Царь Эдип»?	Софокл
Какой древнегреческий математик использовал метод исчерпания для вычисления площади круга?	Архимед
Какой древнегреческий философ первым выдвинул идеи атомизма?	Демокрит
Какой древнегреческий физик открыл концепцию плавучести во время принятия ванны?	Архимед
Кто из древнегреческих ученых заложил основы будущей европейской математики и написал «Начала» геометрии?	Эвклид
Какое животное изображено на заднем плане полководца Ричарда I?	Собака
Какая художественная группа известна как «национальное достояние» Канады?	Cirque du Soleil
Какой художник нарисовал всемирно известную «Девушку с жемчужной сережкой»?	Йоханнес Вермеер
Какой художник потряс мир, уничтожив на аукционе копию своей работы «Девушка с воздушным шаром»?	Бэнкси
Какой астроном предложил гелиоцентрическую теорию в XVI веке?	Николай Коперник
Какой напиток изобрел американский фармацевт Джон Пембертон?	Кола
Какая британская звезда выступала на церемонии открытия ЧМ-2018?	Робби Уильямс
Какой бафф можно получить, заняв Святилище храбрости?	Увеличение опыта, получаемого командирами
Какое здание было первоначально построено в Лондоне для проведения Великой выставки промышленных произведений всех наций, проходившей в 1851 году?	Хрустальный дворец
Какой вождь Сероли родом из Хорн-Бей?	Кира
Какой вождь Сероли родом из Саблезубой Долины?	Ак энд Хок
Какой вождь Сероли владеет кинжалом и луком?	Вафура
Какой вождь Сероли обитает в месте, известном как Лес Смерти?	Декар
Какому вождю Сероли было поручено охранять Скалы Ярости?	Астрид
Какой вождь Сероли имеет власть над морозом?	Фрида
Какой вождь Сероли когда-то окружил Цитадель Храбрецов со своими войсками?	Торгный
Кто из вождей Сероли охраняет Белокаменную башню?	Фрида
Какой вождь Сероли более 20 лет стоял в гарнизонах Северных Пределов?	Торгный
Какой вождь Сероли использует лук в качестве оружия?	Кира
Какой вождь Сероли владеет двумя видами оружия одновременно?	Астрид
Какой вождь Цероли работает вместе со змеей?	Декар
Какое племя вождя Сероли уже несколько поколений живет в ледяных пустошах?	Вафура
В какой главе «Хроник Королевства» можно получить достижение «Исследователь жизни», если весь туман будет исследован до конца главы?	Долгий покой
Какой вождь из события «Кризис Цероли» хорошо разбирается в магии яда?	Декар
Кто из вождей во время кризиса в Чероли совершил успешный переворот?	Торгный
Какую китайскую династию помог основать Цзян Цзыя?	Династия Чжоу
В каком городе проходили летние Олимпийские игры 2000 года?	Сидней
Какой город-государство победил Спарту в «Битве при Левктрах»?	Фивы
Какой город-государство Древней Греции был известен своей жестокой военной выучкой и храбростью?	Спарта
Какой гражданский аэропорт находится выше всего над уровнем моря?	Аэропорт Даочэн Ядин
Какая цивилизация первой обзавелась общественными туалетами?	Древний Рим
В каком клубе футболист Лионель Месси играл дольше всего?	Барселона
Какой клуб выиграл больше всего титулов английской Премьер-лиги?	Манчестер Юнайтед
О каком полководце можно сказать, что у него самые густые брови в Rise of Kingdoms?	Цао Цао
Какой командир НЕ получает повышения уровня навыка от легендарной скульптуры командира?	Ганнибал Барса
У какого командира корабль изображен на заднем плане?	Пелагиус
У кого из полководцев корона с драгоценными камнями другого цвета, чем у остальных?	Грузинская царица Тамар
Какого полководца принято считать воплощением идеала «духа Бусидо»?	Кусуноки Масасигэ
Какой командир известен как «Бессмертный молот»?	Чарльз Мартелл
Какой полководец известен как Барбаросса?	Фридрих I
Какой командир известен как Полководец Камакуры?	Минамото-но Ёсицунэ
Какой полководец известен как Покоритель Хаоса?	Цао Цао
Какой полководец известен как Леди Мерсийцев?	Этельфлед
Какой полководец получил прозвище "Лук Революции"?	Йи Сон Ге
Какой полководец получил прозвище Хранитель Карфагена?	Ганнибал Барса
Какого полководца прозвали Отцом Завоеваний?	Бейбарс
Какой полководец получил прозвище Ревущий варвар?	Лохар
Считается, что какой полководец сказал: «Я пришел, я увидел, я победил»?	Юлий Цезарь
Какая роль командира обеспечивает увеличение нагрузки на войска?	Капитан снабжения
Какой полководец говорит: "Моя судьба определяется верой и возможностью"?	Матильда Фландрская
Какой полководец проявил свой военный гений в битве при Туре в 8 веке нашей эры?	Чарльз Мартелл
Какой полководец подписал мирный договор с Саладином в 1192 году?	Ричард I
Какой полководец с ранних лет считался врагом Рима?	Ганнибал Барса
Какой полководец отвечал за захват Константинополя в возрасте 21 года?	Мехмед II
Какой полководец был известен как Кельтская Роза?	Боудикка
Какой командир был в паре с Минамото?	Томоэ Годзэн
Кто из полководцев владеет навыком «Красота и мудрость»?	Клеопатра VII
Какой активный навык командира может накладывать Безмолвие?	Герман
Какой композитор написал оперу «Кольцо нибелунга»?	Вагнер
На каком континенте самые низкие средние температуры?	Антарктида
Какой континент был родиной цивилизации майя?	Северная и Южная Америка
На каком континенте располагалась империя инков?	Южная Америка
За какую страну выступал Арьен Роббен?	Нидерланды
Из какой страны был родом знаменитый поэт Данте Алигьери?	Италия
Из какой страны был родом Заратустра, автор поэмы «Так говорил Заратустра»?	Персия
Какая страна подарила Статую Свободы американскому народу?	Франция
Какая страна приняла кетцаль в качестве своей национальной птицы?	Гватемала
Какая страна участвовала в 8 чемпионатах мира, но ни разу не проходила дальше группового этапа?	Шотландия
Какая страна возглавляла мировой рейтинг ФИФА, но никогда не выигрывала чемпионат мира?	Бельгия
Какая страна выиграла больше всего чемпионатов мира?	Бразилия
Какая страна выигрывала чемпионат мира пять раз?	Бразилия
Какая страна принимала и выиграла чемпионат мира 1930 года?	Уругвай
Какая страна принимала и выиграла чемпионат мира 1978 года?	Аргентина
Какая страна принимала чемпионат мира 1994 года?	Соединенные Штаты Америки
Какая страна принимала чемпионат мира 1998 года?	Франция
Какая страна принимала чемпионат мира по футболу 2022 года?	Катар
Какая страна принимала первые в истории зимние Олимпийские игры 25 января 1924 года?	Франция
Какая страна принимала первый чемпионат мира по футболу?	Уругвай
В какой стране находится Чатал-Хююк?	Турция
Какая страна ответственна за изобретение сыра с плесенью, известного своим острым вкусом?	Франция
Какая страна использовала оранжевый цвет в качестве талисмана чемпионата мира по футболу?	Испания
Какой стране было позволено сохранить Трофей Жюля Риме на постоянной основе?	Бразилия
Против какой страны сражалась Англия в битве при Азенкуре?	Франция
В какой стране родился Марко Поло, знаменитый мореплаватель и купец?	Венецианская республика
Из какой страны был родом композитор Франц Шуберт?	Австрия
Какая страна стала первой азиатской страной, вышедшей в полуфинал чемпионата мира?	Корея
Какая страна первой изобрела духи?	Кипр
Какая страна выиграла чемпионат мира по футболу 2018 года, проходивший в России?	Франция
Исследователи какой страны первыми высадились в Антарктиде?	Норвегия
Сборная какой страны играла на всех чемпионатах мира?	Бразилия
Какие украшения из греческой мифологии могут соорудить правители в своем городе?	Пегас
Какое божество древнеегипетской мифологии изображал обелиск?	Ра
Какой полубог захватывает Цербера, «трехголового пса Аида», согласно греческой мифологии?	Геркулес
Какого голландского ученого называют «отцом микробиологии»?	Антони ван Левенгук
Какой египетский город отмечал границу между Верхним и Нижним Египтом в додинастический период?	Мемфис
Какой император издал Миланский эдикт?	Константин I
Какой император издал Миланскую прокламацию?	Константин I
Какого императора называли «Ханом Неба» различные тюркские кочевники во времена династий Суй и Тан?	Император Тан Тайцзун
Какой энтомолог и астроном из Новой Зеландии первым предложил перейти на летнее время?	Джордж Хадсон
Какая этническая группа основала самую раннюю цивилизацию Месопотамии?	Шумеры
Король какой европейской страны финансировал знаменитую экспедицию Христофора Колумба?	Испания
Кто из европейцев написал первые путевые заметки с подробным описанием истории, культуры и искусства Китая?	Марко Поло
К какому известному и влиятельному роду принадлежал знаменитый меценат эпохи Возрождения герцог Лоренцо?	Дом Медичи
Какого знаменитого японского самурая в детстве звали «Усивакамару»?	Минамото-но Ёсицунэ
На какой знаменитой скульптуре изображен плачущий ребенок?	Писающий мальчик
С какой фигурой из греческой мифологии Мэри Шелли ассоциировался монстр Франкенштейна?	Прометей
Кто из исторических личностей переоделся прусским капитаном и скрылся с более чем 4000 золотыми марками только для того, чтобы позже считаться народным героем и называться «капитаном Кёпеника»?	Вильгельм Фогт
Какой фильм получил награду «Лучший фильм» на первой в истории премии «Оскар»?	Крылья
Какой вкус банки супа НЕ появляется в знаменитой работе Энди Уорхола под названием «Банки супа Кэмпбелла»?	Кукуруза
Для какого формирования предназначен вооружение «Имперский боевой барабан»?	V
Какой французский монарх был известен как «Людовик Святой»?	Людовик IX
Какая руна Футарк олицетворяет Тира, бога войны и справедливости в германской мифологии?	Тиваз
Какой газ составляет более 90% атмосферы Марса?	Двуокись углерода
Какой немецкий психолог открыл кривую забывания человеческого мозга?	Герман Эббингауз
Какой вратарь забил больше всего голов в профессиональном футболе?	Рожерио Сени
Какой бог Таранис в кельтской мифологии?	Бог Грома
Какая греческая богиня изображена на трофее Жюля Риме, оригинальном трофее Кубка мира?	Найк
Какой изобретатель построил первый в мире электровоз в 1837 году?	Роберт Дэвидсон
