Кратер на обратной стороне Луны назван в честь китайского чиновника, который был (предположительно) первым человеком, побывавшим в космосе. Как его звали?,Ван Ху
Уменьшение какого из следующих показателей может указывать на увеличение близости к состоянию вакуума?,Атмосферное давление
Из какого материала сделан человеческий ноготь?,Альфа-кератин
Робот не может причинять вред человеку или своим бездействием допустить причинение вреда человеку. Что это за «Три закона робототехники» Айзека Азимова?,Закон первый
Согласно греческой мифологии, какие два бога превратились в «рыбу» в символе Рыб?,Афродита и Эрос
Согласно хронологии майя, поздний доклассический период относится к:,С 1 г. до н.э. по 159 г. н.э.
Согласно сказке о волчице в римской мифологии, что случилось с близнецами, которых она вскормила, Ромулом и Ремом?,Ромул стал основателем и первым царем Рима
По данным World Athletics, какой из них НЕ является официальным международным весом диска?,1,25 кг
Какие из этих достижений открываются при получении командора Вильгельма I?,Путь Славы
К преимуществам печатного станка Иоганна Гутенберга можно отнести все нижеперечисленное, кроме чего?,Усиление церковной власти
После того, как венерина мухоловка ловит насекомое, как она переваривает и поглощает добычу?,Внутренние створки листьев выделяют пищеварительную жидкость
После своего основания в VI веке до н.э., какой институт Римской республики служил консультативным парламентом?,Сенат
После того, как Затерянное Королевство откроется, какой предмет вам нужно потратить, чтобы телепортироваться в Затерянное Королевство и обратно?,Случайный телепорт
После того, как ученики Лицея Мудрости закончат свои уроки, в какое здание в вашем городе они возвращаются?,Академия
Послесвечение вызывается:,Рассеяние света в воздухе
Помощь Альянса НЕ может ускорить какое из следующих действий?,Подготовка войск
Аметист ценится за свой блестящий фиолетовый оттенок. Из какого минерала она разновидность?,Кварц
Кроме «Количества разведчиков» и «Силы», какие из следующих параметров Скаутского лагеря также можно улучшить?,Скорость марша разведчика и дальность исследования
Помимо «Времени, когда вам можно помочь» и «Силы», какие из следующих параметров Центра альянсов также можно улучшить?,Вместимость войск подкрепления
Сколько раз Шакира выступала на церемонии закрытия ЧМ-2018?,3.0
По состоянию на чемпионат мира 2018 года, сколько чемпионатов мира выиграла Бразилия?,5.0
По состоянию на чемпионат мира 2018 года, каков лучший результат Соединенных Штатов на чемпионате мира за всю историю?,Третье место
По состоянию на чемпионат мира 2018 года, какой игрок является рекордсменом по количеству голов, забитых в одном матче чемпионата мира с пятью голами?,Олег Саленко
Кто является рекордсменом по количеству голов, забитых на чемпионате мира по футболу 2018 года?,Мирослав Клозе
На чемпионате мира 2018 года, кому принадлежит рекорд чемпионата мира по самому быстрому голу, забитому за 11 секунд?,Хакан Шюкюр
По состоянию на чемпионат мира по футболу 2022 года, сколько стран выиграли чемпионат мира?,8.0
По состоянию на 21-й чемпионат мира, кто является единственным игроком, который сделал хет-трик на 2 разных чемпионатах мира?,Габриэль Батистута
Ашока Великий был царем какого древнеиндийского царства?,Маурья
Если предположить отсутствие каких-либо других специальных баффов, то у кого из этих командиров самая высокая скорость марша?,Велизарий
На каком уровне ставка транспортного налога для торговых постов становится 10%?,24.0
На каком VIP-уровне вы можете приобрести специальный VIP-сундук, в котором содержится достаточное количество скульптур Ганнибала Барсы, чтобы пробудить его?,14.0
На каком VIP-уровне вы навсегда разблокируете вторую очередь строительства?,Уровень 6
Бутан также известен как Земля Громового Дракона. Какова его столица и крупнейший город?,Тхимпху
В какой из следующих стран находится Биг-Бен?,Великобритания
Шварцвальдский торт – знаменитый европейский десерт. В какой стране находится Шварцвальд, от которого он получил свое название?,Германия
Босса-нова – популярный жанр музыки, родом из какой страны?,Бразилия
Каким витамином богата брокколи?,Витамин С
Под каким еще названием Ceroli Chieftains Ak & Hok также известны?,Астральные Близнецы
Под каким еще названием известен октябрь по старому японскому календарю?,Каннадзуки
Под каким другим именем также известен вождь Чероли Вафура?,Волчья тень
Колючки кактуса на самом деле являются видоизмененной формой какой другой части растения?,Листва
В какой стране находится регион Шампани?,Франция
Из какого материала Чарльз Макинтош изготовил очень раннюю версию плаща?,Резина
Китайский формат скетч-комедии берет свое начало в трех местах: Тяньцяо в Пекине, базар Цюанье в Тяньцзине и где в Нанкине?,Фуцзымяо
Тактика ведения боя является важной военной технологией – какой эффект она дает?,Увеличивает Атаку всех юнитов
Какой из следующих типов боевых единиц можно использовать навык командира Бьорна Айронсайда «Повелитель викингов»?,Пехота
В последней книге Дарвина в основном говорилось о влиянии каких видов на почву?,Червей
Диего Веласкес, автор реалистического произведения «Портрет папы Иннокентия X», был родом из какой страны?,Испания
Во время солнечного затмения небесный объект, находящийся между Солнцем и Землей, является:,Луна
Какое государство в период Воюющих царств Китая победило остальные шесть и построило единую китайскую империю?,Цинь
Какой из следующих элементов во время ядерного синтеза производит меньше энергии, чем поглощает?,Железо
Почему в эпоху Возрождения Флоренция была так важна?,Место рождения и символ эпохи Возрождения
Во время Второй Пунической войны, в каком сражении значительно превосходящий по численности Ганнибал победил римскую армию?,Битва при Каннах
Какой греческий воин убил Гектора во время Троянской войны?,Ахилл
Какого цвета была корона фараона Верхнего Египта в период Верхнего и Нижнего Египта?,Белый
Во время правления какого императора был завершен римский Колизей?,Тит
В какое время года ночи относительно короткие, а дни относительно длинные?,Лето
Эдуард VIII стал королем Англии в январе 1936 года. В каком месяце того же года он отказался от престола?,Декабрь
Экономика Египта в первую очередь основывалась на чем?,Сельское хозяйство
Из какого материала египтяне делали бумагу?,Папирус
День Эльбы был встречей двух армий во время Второй мировой войны?,США, СССР
Характеристики экипировки с особыми бонусами талантов будут усилены на какой процент при экипировке командира с соответствующим талантом?,30%
Фейжоада считается национальным блюдом какой страны?,Бразилия
Впервые созданная в Древней Греции, к какой профессии относится клятва Гиппократа?,Врачи
Рыба с жареным картофелем берет свое самое раннее происхождение в какой стране?,Англия
Фокачча - это разновидность хлеба, похожего на пиццу. Какая страна (и ее кулинарная культура) создала фокаччу?,Италия
Фуа-гра - очень богатая питательными веществами пища. Какая страна производит больше всего фуа-гра?,Франция
За каждого 1 отряда, которого вы тренируете в своем городе, сколько экспедиционных юнитов вы получаете в режиме экспедиции?,1.0
За сколько франков выкупил Карл V у Бертрана дю Геклена во время конфликта из-за Бретани?,100000.0
От какой болезни Эдвард Дженнер, известный как отец иммунологии, разработал вакцину?,Оспа
Франция и Германия когда-то были частью какого феодального королевства?,Франция
Национальный день Франции отмечается 14 июля, чтобы совпасть с каким историческим событием?,Штурм Бастилии
С 17 по 19 века Королевство Пруссия находилось в основном в какой современной стране?,Германия
С 8-го по 11-й век н.э., как европейцы часто называли скандинавских захватчиков, которые часто разоряли их земли?,Викинги
Эксперимент Галилея с Пизанской башней опроверг теорию какого древнегреческого ученого?,Аристотель
Глобальное потепление НЕ приведет к:,Падение уровня моря
По какому из следующих результатов губернаторы не могут зарабатывать очки активности?,Экспедиции
Комету Галлея можно наблюдать с Земли каждая...,75-76 лет
Сколько времени заняла первая церемония вручения премии «Оскар» в 1929 году?,15 минут
Иероглифы были частью официальной письменности в какой стране?,Древний Египет
Эпос Гомера «Илиада» фокусируется на событиях, происходящих во время какой войны или битвы?,Троянская война
Как получить кредиты Alliance Technology Credits?,Пожертвовав на исследования Alliance Technology
Как получить очки Alliance Technology Points?,Пожертвовав на исследования Alliance Technology
Как получить достижение "Друг Королевства"?,Посетите 100 племенных деревень
Какое место в ежедневном рейтинге Каньона Сансет вам нужно занять, чтобы получить ежедневные награды «Золотой ключик»?,В топ-5
Как долго длилась Столетняя война между Англией и Францией?,116 лет
Как долго действует буст "Базовое расширение армии"?,4ч
Как долго руна, выпавшая после победы над Стражами, остается на карте?,8 часов
Сколько «Сокровищ снаряжения Золотого королевства» содержится в золотом сундуке, заработанном на 16-м этапе события «Золотое королевство»?,3.0
Сколько стрел застряло в щите командира Лохара?,4.0
Сколько зверей вы можете ожидать увидеть, сражаясь бок о бок с войсками варваров 20 уровня в Rise of Kingdoms?,1 медведь и 2 волка
Сколько костей в норме у взрослого человека?,206.0
Сколько лучников тренируется в стрельбе из лука во время тренировки составных лучников?,3.0
Сколько всего карт в руках Таинственного Торговца?,5.0
Сколько ежедневных очков активности нужно в «Люцернских свитках», чтобы получить подсказку «Ежедневный подарок»?,50.0
Сколько дней в високосном году?,366 дней
Сколько депеш нужно выполнить на Государственном форуме, чтобы открыть Благодарность за отправку?,15.0
Сколько пасхальных яиц изображено в рамке аватара для пасхальных яиц?,5.0
Сколько изумрудов изображено на одежде командора Матильды Фландрской?,5.0
Сколько флагов вывешено перед Центром Альянса французской цивилизации?,6.0
Сколько шестеренок изображено на иконке для экономической технологии "Машиностроение"?,2.0
Сколько голов нужно забить игроку, чтобы оформить хет-трик?,3.0
Сколько золотых ключей присуждается губернатору, занявшему первое место в каждом сезоне Каньона Сансет?,5.0
Сколько ураганов было зарегистрировано вокруг Тихого океана в 1977 году?,4.0
Сколько индивидуальных кредитов можно заработать, продавая чертежи обычного снаряжения с помощью функции возврата в магазине альянса?,400.0
Сколько индивидуальных заданий включает в себя экспедиция?,90.0
Сколько предметов одинакового качества нужно надеть, чтобы выполнить задание «К бою»?,6.0
Сколько ключевых очков нужно, чтобы открыть сокровищницу синего кристалла в подарках альянса?,3000000.0
Сколько ключей входит в Подарок Альянса, полученный за разрушение Форта варваров 5 уровня?,60.0
Сколько ключей входит в подарок альянса «Деревянный сундук»?,10.0
Сколько клавиш в типичном современном пианино?,88.0
Сколько легендарных скульптур командира получит игрок, занявший первое место в общем рейтинге в событии «Самый могущественный губернатор»?,180.0
Сколько букв используется в сегодняшней версии английского языка?,26.0
Сколько Медалей Завоевателя нужно для покупки Легендарной Скульптуры Командира в Магазине Медалей в режиме Экспедиция?,1500.0
Сколько минут ускорений можно получить, купив «Запас ускорения на 7 дней» в дополнение к немедленной награде в 1 050 самоцветов?,3 150 минут
Сколько обычной железной руды вам нужно, чтобы сделать продвинутую железную руду?,4.0
Сколько офицеров (не считая лидера альянса) может быть в альянсе?,8.0
Сколько золотых олимпийских медалей завоевал афроамериканский спортсмен Джесси Оуэнс в 1936 году?,4.0
Сколько патрульных солдат бродит по стенам губернатора?,7.0
Сколько фаз в событии «Самый могущественный губернатор»?,5.0
Сколько игроков в настольной игре Го?,2.0
Сколько очков можно заработать за 1 очко улучшенной силы в сегменте «Этап 4: Улучшение могущества» события «Самый могущественный губернатор»?,2.0
Сколько очков начисляется за каждого тяжело раненого/убитого отряда 3-го уровня в сегменте «Этап 5: Уничтожение врага» события «Могучий губернатор»?,4.0
Сколько белых медведей изображено на рамке аватара «Сердце Севера»?,3.0
Сколько обновлений доступно за одно посещение Таинственного торговца?,5.0
Сколько сундуков с наградами можно получить за достижение 60 очков ежедневной активности?,3.0
Сколько роз изображено на рамке для аватара «Лепестки роз»?,4.0
Сколько скаутов может вместить скаутский лагерь одновременно?,3.0
Сколько разделов публикуется в «Газете Царства» за исключением особых событий календаря?,5.0
На сколько отдельных ханств или империй распалась Монгольская империя к моменту смерти Хубилая в 1294 году?,4.0
Сколько маленьких палаток можно увидеть в Форте варваров 3 уровня?,6.0
Сколько звезд изображено на знамени, вывешенном позади командира Минамото-но Ёсицунэ?,3.0
Сколько студентов слушают лекции стипендиатов Лицея мудрости?,6.0
Сколько команд участвовало в чемпионате мира 2022 года?,32.0
Сколько команд приняло участие в первом чемпионате мира?,13.0
Сколько палаток изображено на иконке для военно-технического «Лагеря»?,3.0
Сколько клеток занимает мэрия в вашем городе?,9 х 9
Сколько раз вы можете получить помощь альянса, если ваш Центр альянсов 14-го уровня?,18.0
Сколько раз вы можете получить помощь альянса, если ваш центр альянса 25-го уровня?,30.0
Сколько раз Северная Корея квалифицировалась на чемпионат мира?,Два раза
Сколько раз используется символ «1» при написании от цифры 1 до цифры 99?,20.0
Сколько войск рекомендуется для уничтожения Форта варваров 3 уровня?,480,000 Lvl 3 единицы
Сколько войск могут отправить губернаторы с ратушей 17-го уровня или выше?,4.0
Сколько VIP-очков можно купить за 200 самоцветов?,200.0
Сколько сторожевых башен входит в город 25 уровня?,8.0
Сколько колес на таране?,6.0
Сколько женских чемпионатов мира выиграла Меган Рапино?,2.0
Сколько титулов чемпиона мира выиграла Италия?,4.0
Сколько титулов Кубка мира выиграл Пеле?,3.0
Сколько лет проходит между зимними Олимпийскими играми?,4.0
Сколько мест предоставляет госпиталь 15-го уровня (без учета бустов)?,29000.0
На сколько 12-часовой предмет «Усиленная атака» увеличивает атаку ваших войск?,5%
Сколько опыта получает командир за фолиант знаний 7 уровня?,50000.0
Сколько золота стоит один номер «Газеты Царства»?,1000.0
Сколько войск подкрепления получит город на 20 уровне Центра Альянса?,575000.0
Сколько камня будет добывать карьер 17-го уровня каждый час (без учета бустов)?,2775.0
