Какая из следующих историй не входит в число сказок братьев Гримм?	Русалочка
Какие из следующих историй не вошли в «Тысячу и одну ночь»?	Лейла и Меджнун
Какой из следующих проливов находится между Евразией и Северной Америкой?	Берингов пролив
Какая из следующих технологий предшествует "Horsemanship"?	Воинская дисциплина
Какое из перечисленных ниже деревьев обычно встречается в бореальных экосистемах?	Ель
Какие из следующих типов бонусов НЕ действуют в Ark of Osiris?	Рунные баффы
Какой из следующих витаминов наиболее полезен для поддержания хорошего зрения?	Витамин А
Кто из перечисленных ниже был генералом во время японской войны Гэмпэй?	Томоэ Годзэн
Кто из перечисленных ниже был Рыцарем Круглого Стола?	Ланселот
Что из перечисленного ниже было интеллектуальным движением эпохи Возрождения, в рамках которого мыслители изучали классические тексты и сосредотачивались на человеческом потенциале и достижениях?	Гуманизм
Какая из перечисленных ниже стран была также известна как Восточная Римская империя?	Византийская империя
Кто из перечисленных был врагом Ричарда Львиное Сердце?	Саладин
Что из перечисленного было построено по приказу Шах-Джахана в память о его жене Мумтаз-Махал?	Тадж-Махал
Что из перечисленного не было столпом Возрождения?	Манерность
Что из перечисленного не было существенным для визиря, самого высокопоставленного государственного служащего фараона, в Древнем Египте?	Иметь королевскую кровь
Что из перечисленного не было включено в первые летние Олимпийские игры, проходившие в Афинах в 1896 году?	Баскетбол
Кто из нижеперечисленных был восхвален его соотечественниками как лучшие и самые честные демократические представители Древней Греции?	Перикл
Какая из перечисленных ниже медалей была самой высокой в Корейской империи?	Орден Золотого Чеока
Что из нижеперечисленного было написано Мэри Шелли?	Франкенштейн
Кто из них родился в один год с певцом Лучано Паваротти?	Элвис Пресли
Что из перечисленного НЕ помешает вам попасть на поле битвы Ковчега Осириса?	Активация усиления атаки
Какое из следующих произведений основано на битве на перевале Ронсево, в которой сражались Карл Великий и его рыцари?	«Песнь о Роланде»
Какое из следующих произведений НЕ было написано музыкальным маэстро Эндрю Ллойдом Уэббером?	Отверженные
Какое из перечисленных ниже произведений было написано французским драматургом Пьером Корнелем?	Ле Сид
Какое из перечисленных ниже произведений было написано Виктором Гюго?	Горбун из Нотр-Дама
Какое из научных названий птиц также использовалось в память о жене Наполеона III, императрице Франции, Эжени де Монтихо?	Белоголовый фруктовый голубь
Какие из семи чудес света были созданы, чтобы исцелить тоску по дому новой царицы Вавилона?	Висячие сады
Какое из этих достижений можно получить, исцелив 100 000 раненых солдат в госпитале?	Перестройка
Какие из этих действий могут выполнять лидеры альянса и титулованные офицеры, но НЕ нетитулованные офицеры?	Зарегистрироваться в Ark of Osiris
Какой из этих активных навыков принадлежит Чарльзу Мартеллу?	Бессмертный щит
Какой из этих активных навыков принадлежит Чарльзу Мартеллу?	Щит Франции
Какой из этих аэропортов имеет взлетно-посадочные полосы на пляже?	Аэропорт Барра
Кто из этих офицеров альянса дает прибавку к скорости исследования?	Советник
Какие из этих навыков альянса увеличивают урон по варварам и другим нейтральным юнитам?	Безудержный прогресс
Какие из этих навыков альянса повысят вашу скорость сбора ресурсов?	Полная загрузка
Кого из этих древнегреческих драматургов считают «отцом трагедии»?	Эсхил
Кто из этих древнегреческих философов не участвовал в дискуссии о справедливости в «Государстве» Платона?	Протагор
Кого из этих древнегреческих писателей считают «отцом комедии»?	Аристофан
Какой из этих анимационных фильмов НЕ был снят Хаяо Миядзаки?	Паприка
Какие из них являются беспозвоночными?	Коралл
В какой из этих областей находится водяное колесо?	Пахотные земли Альянса
Кто из этих художников НЕ был художником эпохи барокко?	Винсент Ван Гог
Какие из этих рамок для аватара доступны для покупки?	Лепестки роз
Какие из этих рамок для аватара можно получить в событии «Кризис Чероли»?	Подводное царство
Какое из этих Благословений сразу же наносит противнику 10% потери силы войск в начале боя в событии «Золотое королевство»?	Якорь
Какая из этих книг не была написана греческим философом Аристотелем?	Республика
Какие из этих усилений работают в экспедициях в Rise of Kingdoms?	Все из них
Какие из этих усилений работают в Каньоне Сансет?	Вместимость войск VIP-уровня
Какое из этих зданий НЕ является одним из Новых Семи Чудес Света?	Версальский дворец
Кто из этих византийских императоров правил вместе с четырьмя другими императорами в разное время, а затем был объявлен единственным императором Рима после 63 лет правления?	Константин VIII
Кого из этих вождей Сероли также называют Вестниками бури?	Торгный
Кого из этих вождей Цероли также называют Несущим Бедствия?	Декар
Кто из этих персонажей из «Двадцати тысяч лье под водой»?	Капитан Немо
Какая из этих китайских этнических групп известна тем, что пьет кумыс, напиток из ферментированного кобыльего молока?	Монголов
Какие из этих обстоятельств помешали бы вам изменить цивилизацию?	Постоянные тренировки войск в вашем городе
Какой из этих городов принимал Олимпийские игры в 1900 году?	Париж
Какой из этих городов Бразилии принимал Олимпийские игры?	Рио-де-Жанейро
Какой из этих городов находится в Южной Америке?	Буэнос-Айрес
Какой из этих городов НЕ находится в Азии?	Мельбурн
В какой из этих городских тематик есть воздушные шары?	Коттедж «Урожай»
Какая из этих городских тем дает бонус к особым характеристикам: +5% к кавалерийской атаке и -5% к здоровью лучника?	Песнь сеятеля
Какая из этих цивилизаций может повысить защиту лучников?	Корея
Какая из этих цивилизаций может увеличить скорость исцеления?	Франция
Какая из этих цивилизаций может увеличить вместимость своих больниц?	Византия
Кто из этих полководцев носит лук и стрелы так же, как и меч?	Этельфлед
Кто из этих командиров НЕ носит щита?	Карла великого
Кто из этих командиров НЕ носит меча?	Феодора
У кого из этих командиров на заднем плане изображены снежинки?	Бьорн Айронсайд
Кто из этих командиров получает возможность превращать убитых юнитов в тяжелораненых при нападении на город?	Карла великого
Кого из этих полководцев называли «Святым Повелителем»?	Эль Сид
У кого из этих командиров есть ветка атаки в дереве талантов?	Центурион
У кого из этих командиров НЕТ усов или другой растительности на лице?	Александр Македонский
У кого из этих командиров есть активный навык «Чары»?	Шарка
Кто из этих командиров лысый?	Рагнар Лодброк
Кто из этих командиров НЕ показан в плаще?	Мехмед II
О каком из этих командиров часто говорят, что он пережил 57 сражений, не потерпев ни одного поражения?	Хонда Тадакацу
Кто из этих командиров носит кольцо на руке?	Грузинская царица Тамар
Кто из этих командиров получит бонус от музейной реликвии «Надпись драконов-близнецов»?	Йи Сон Ге
Какой из навыков мастерства этих командиров является улучшенной версией существующего навыка?	Бьорн Айронсайд
Какие из скульптур этих командиров можно получить, открыв сундук в таверне в Rise of Kingdoms?	Чарльз Мартелл
Какая из этих согласных звучит трелью при произношении по-итальянски?	r
Какая из этих стран НЕ участвовала в Северной Семилетней войне (1563-1570)?	Соединенное Королевство
Через какую из этих стран проходит нулевой меридиан?	Мали
Какая из этих стран оказала наибольшее влияние на развитие кубинской кухни?	Испания
Какая из этих стран НЕ была членом-основателем НАТО (в 1949 году)?	Турция
Какое из этих существ также широко использовалось в качестве своеобразного личного защитного талисмана в Древнем Египте?	Скарабеев
Какое из этих украшений НЕ стоит драгоценных камней?	Дерево сакуры
Какое из этих декоративных сооружений также считается предзнаменованием удачи в китайской культуре?	Китайский дракон
Какой из этих эффектов НЕ вызван навыками Этельфледа?	Лечение легко раненых юнитов
Какие из этих соревнований НЕ являются частью Олимпийских игр?	Автомобильные гонки
Какая из этих женщин-командиров была названа «грузинской волей»?	Грузинская царица Тамар
У кого из этих женщин-командиров в волосах цветы?	Боудикка
Какая из этих областей НЕ входит в список Нобелевских премий?	Математика
Кто из этих деятелей империи Селевкидов был взят в заложники Римом, впоследствии бежал из Рима, а затем вернулся, чтобы захватить трон своей родины?	Димитрий I
Какой из этих фильмов НЕ был снят Питером Уиром?	Отряд
Какую из этих продуктов не мог съесть государственный деятель династии Восточная Хань Цао Цао?	Кукуруза
Какой из этих фруктов изображен на заднем плане для командира Имхотепа?	Банан
Кто из этих богов Древнего Египта был также символом царской власти?	Гора
Кто из этих исторических личностей НЕ был ботаником?	Дмитрий Менделеев
Какое из этих святых мест дает бонус к скорости марша?	Святилище Ветра
Какой из этих ингредиентов используется для приготовления соевого соуса?	Соевые бобы
Какая из них является линией Томоэ Годзэн?	Моя сила пугает даже призраков.
Что из этого является пассивным навыком полководца Тутмоса III?	Завоевание Митанни
Что из этого является неправильным описанием «битвы при Пуатье»?	Кампания проходила во время Первой мировой войны
Что из этого является неверным описанием «Моря Имбриума» на Луне?	В нем содержится некоторое количество осадочной воды
Что из этого является неправильным описанием энергии ветра?	Это не форма возобновляемой энергии
Какое из них считается основополагающим произведением французского драматурга Мольера?	Тартюф
Что из этого можно найти в Золотом сундуке альянса?	1 000 индивидуальных кредитов
Что из этого НЕ является крахом технологий альянса?	Военный
Что из этого НЕ относится к категории почтовых отчетов?	Сбор
Что из этого НЕ является пассивным навыком командира Минамото но Ёсицунэ?	Достойный человек
Что из этого не является мастерством генерала Чероли Кейры?	Красный хамелеон
Что из этого НЕ является разновидностью японского вагю	Ронгухон Вагю
Что из этого НЕ является типичным этапом очистки сточных вод?	Разряд
Что из этого НЕ является навыком Альянса?	Стремительный марш
Какая из них не является древней цивилизацией Северной и Южной Америки?	Шумеры
Какая из них не является официальной песней ЧМ-2022?	"Тату" Бом де Бола
Что из этого НЕ считается шекспировской трагедией?	Двенадцатая ночь
Кто из них НЕ считается одним из «пяти хороших императоров» династии Нерва-Антонинов Древнего Рима?	Коммодус
Какой из них НЕ считается одним из 8 основных стилей современной китайской кухни?	Кухня Хуайяна
Что из этого НЕ является одним из навыков Цао Цао?	Битва Скорби
Что из этого НЕ является одним из навыков вождя Сероли Астрид?	Поцелуй Языку Пламени
Что из этого не относится к трем сестрам Горгоны из греческого мифа?	Перга
Какая из них НЕ является одной из выигрышных стратагем, перечисленных в древнекитайском военном учебнике «Тридцать шесть стратагем»?	Стратегия «пустого форта»
Что из этого не является частью Святой Троицы в христианстве?	Мать
Кто из них НЕ является ребенком Зевса в греческой мифологии?	Гера
Что из этого является одним из активных навыков Дяочаня?	Танец Хаоса
Какой из них является одним из "Активных навыков" Минамото-но Ёсицунэ?	Кёхатирю
Какой из них является одним из четырех фундаментальных элементов природы, по мнению многих древнегреческих философов?	Ветер
Какой из них является самым посещаемым художественным музеем в мире за последние годы?	Лувр
Какой из них является национальным цветком Индии?	Лотос
Какой из них используется для сплочения войск Альянса?	Замок
В каком из них Ли Сонг-Ге является экспертом?	Гарнизон
Какой из этих островов считается родиной минойской цивилизации?	Крит
Какие из этих предметов НЕЛЬЗЯ получить, победив варваров?	VIP-очки
Какие из этих предметов НЕЛЬЗЯ купить в Таинственном купеческом бутике?	Страница паспорта
Какие из этих предметов НЕЛЬЗЯ получить из сундука со снаряжением в таверне?	60-минутное ускорение тренировки
Какие из этих предметов нельзя получить из сундука со снаряжением?	Фолианты знаний
Какие из этих предметов НЕЛЬЗЯ получить из Сундука с камнями Альянса?	Серебряные ключи
Какой из этих предметов содержит полезную информацию о том, как древний египтянин может перейти в мир иной после смерти?	Книга мертвых
Какой из этих предметов можно выбрать из сундука с ресурсами «Выбери один» 3-го уровня?	150 000 ед.
Какие из этих легендарных фраз НЕ приписываются командиру Эль Сиду?	За честь и империю!
Кто из этих тренеров руководил пятью командами Кубка мира?	Бора Милутинович
Какие из этих материалов используются для изготовления снаряжения для сбора и поддержания мира?	Кость животного
Какая из этих современных стран НЕ находится на исторической территории цивилизации майя?	Доминиканская Республика
Кто из этих мореплавателей первым прибыл в Бразилию?	Педро Альварес Кабрал
Какая из этих Нобелевских премий была присуждена Марии Кюри в 1903 году?	Нобелевская премия по физике
Какой из этих романов является первым в истории японским художественным произведением, основанным на легенде о короле Артуре?	Кайро-ко
Какой из этих романов НЕ был написан Маргарет Этвуд?	Цветы для Элджернона
Штаб-квартира какой из этих организаций находится в Женеве?	Управление Верховного комиссара ООН по делам беженцев
Кто из этих людей не получил Нобелевскую премию по физике в 2022 году?	Карл Барри Шарплесс
Кто из этих философов не был сторонником философской школы кинизма?	Сократ
Какое из этих растений НЕДОСТУПНО в качестве декоративной постройки?	Персиковое дерево
Какая из этих пьес не была написана древнегреческим трагиком Еврипидом?	Антигона
Кто из этих польских пианистов был также премьер-министром Польши?	Игнаций Ян Падеревский
Кто из этих художников эпохи Возрождения не был родом из Италии?	Шекспировский
Какие из этих наград НЕ будут вручены игроку, занявшему первое место в сезоне в Каньоне Сансет?	Ослепительная скульптура звездного света
Какая из этих рек протекает через Африку?	Нил
Какая из этих рек находится в Азии?	Евфрат
Кто из этих командиров РК родом из Чероли?	Кира
Какая из этих скульптур была работой древнегреческого скульптора Фидия?	Статуя Зевса в Олимпии
Какие из этих навыков, принадлежащих командиру Сунь Цзы, усиливаются после пробуждения?	Военное искусство
